{
  "domain": "cross-border-tourism-data",
  "version": 2,
  "sample_id": "record-014",
  "actors": [
    "目的地文旅机构",
    "景区与活动主办方",
    "票务平台方",
    "平台运营方",
    "数字导览产品方",
    "数字人服务方",
    "跨境产品运营方",
    "国际游客"
  ],
  "content_types": [
    "景点",
    "路线",
    "文化说明",
    "票务政策",
    "签证提示",
    "实时提醒"
  ],
  "facts": [
    "旅游展区聚集多个国家和地区的机构企业",
    "合作方向包括数据互通和服务标准互认",
    "多语种导览与数字化服务用于改善跨境旅行体验",
    "同一景区的开放时间可能分别来自目的地机构、票务平台和旧宣传册且互相冲突",
    "自动翻译可能曲解安全提醒，译文须经审核修订",
    "合作覆盖五十六个国家和地区，人工群聊无法保证游客看到可靠版本"
  ],
  "workflow": [
    "来源机构提交景点、路线、文化说明、票务政策、签证提示和实时提醒",
    "对应机构审核通过后资料方可发布",
    "导览、数字人和跨境产品按获授权的语言与渠道引用",
    "变更发生时列出全部受影响产品并推动更新"
  ],
  "change_events": [
    "标准字段改变",
    "译文修订",
    "临时闭园",
    "授权到期",
    "内容争议",
    "来源撤回"
  ],
  "constraints": [
    "多国文旅资料",
    "翻译与审核版本",
    "授权使用范围",
    "下游影响追踪",
    "游客页面标明责任来源和更新时间",
    "各机构保留对自己资料的控制权",
    "依据资料完整度推进标准互认",
    "不能用访问量替代可信度"
  ]
}
